{
  "$schema": "./config.schema.json",
  "site": {
    "title": "Measuring Source Fidelity, Exculpatory Recall, and Generative Suspicion in AI-Drafted Police Reports",
    "venue": "AAAI 2026 Fall Symposium Series",
    "description": "FACETS-PR is a six-axis framework of sixteen metrics, with a vendor-independent protocol, for measuring the substantive quality of AI-drafted police reports. It is instantiated on four open-weight models over BWCSyn-90, a synthetic, ground-truth-annotated body-worn camera corpus.",
    "keywords": "AI-Assisted Police Reports, Large Language Models, Source Fidelity, Exculpatory Recall, Brady, Generative Suspicion, Dialect Parity, African American English, California SB 524, Penal Code 13663, Body-Worn Camera, Measurement, Evaluation, FACETS-PR, BWCSyn-90, AAAI Fall Symposium 2026",
    "favicon": "favicon.ico",
    "lang": "en",
    "url": "",
    "publicationDate": "2026"
  },
  "authors": [
    {
      "name": "Aizierjiang Aiersilan",
      "url": "https://ezharjan.github.io/",
      "affiliations": [ 1 ]
    },
    {
      "name": "Yeershanati Wuernikebai",
      "affiliations": [ 2 ]
    }
  ],
  "affiliations": [ { "id": 1, "name": "The George Washington University" }, { "id": 2, "name": "Washington and Lee University School of Law" } ],
  "links": [
    {
      "type": "paper",
      "label": "Paper",
      "icon": "fas fa-file-pdf",
      "url": "https://aaai.org/conference/fall-symposia/2026-fall-symposium-series-2/",
      "enabled": true
    },
    { "type": "arxiv", "label": "arXiv", "icon": "ai ai-arxiv", "url": "https://arxiv.org/", "enabled": true },
    { "type": "code", "label": "Code", "icon": "fab fa-github", "url": "https://github.com/Ezharjan/FACETS", "enabled": true },
    { "type": "dataset", "label": "Dataset", "icon": "fas fa-database", "url": "https://github.com/Ezharjan/FACETS/tree/master/data", "enabled": true },
    { "type": "poster", "label": "Poster", "icon": "fas fa-file-image", "url": "paper_poster.pdf", "enabled": false },
    { "type": "confab", "label": "Confab", "icon": "fas fa-calendar-check", "url": "https://cal.com/ezhar/30min", "enabled": true }
  ],
  "abstract": {
    "title": "Abstract",
    "body": "California Senate Bill 524, codified at Penal Code §&nbsp;13663 and effective 1 January 2026, is the most prescriptive state regulation to date of the artificial-intelligence systems that draft official law-enforcement reports. It compels disclosure, officer certification, retention of the first AI draft, and an audit trail, yet it says nothing about the substantive quality of the draft it makes discoverable, and the empirical record to date consists of a field trial of writing speed, officers’ own perceptions, and human-rater quality scales. We propose <b>FACETS-PR</b> (<b>F</b>idelity, <b>A</b>symmetric exculpatory recall, <b>C</b>ognitive disengagement, <b>E</b>quity, <b>T</b>raceability, <b>S</b>uspicion inflation, for <b>P</b>olice <b>R</b>eports), a six-axis framework of sixteen metrics, each treated as a measurement model whose construct-validity claim is stated explicitly rather than assumed. Two components are new: a computational form for the doctrinal notion of generative suspicion, and a paired-dialect probe, adapted from the matched-guise paradigm, that pairs Standard American English transcripts with African American English renderings of the same propositional content. A vendor-independent protocol accompanies the framework, running end to end on open-weight models over a synthetic, ground-truth-annotated body-worn camera corpus stratified by conditions that vendor documentation identifies as degrading draft quality. Instantiating it on four open-weight models yields five findings and two surprises. Quotation-marked retention of evidentiary utterances falls far below one half for every model, with large effect sizes, although a per-utterance audit attributes more of the shortfall, pooled across the panel, to verbatim reproduction stripped of its quotation marks than to paraphrase. No model emits the statutory disclosure string by default. Inculpatory content is recalled more reliably than exculpatory content in two of four models, an asymmetry that survives a direct test against the competing explanation that it merely tracks ground-truth set sizes. Sentences asserting legal conclusions that no single transcript turn entails appear in every model, at a rate that is reliably above zero when the panel is pooled but that no individual model’s test resolves after correction for multiple comparisons. Officer-role reviewers leave roughly one deliberately impossible sentence in five standing. Against prediction, the drafts hedge rather than harden the transcript’s epistemic stance, and we detect no dialect disparity on any suspicion-axis metric, nor on the recall asymmetry. The panel is deliberately modest, comprising quantised three- to eight-billion-parameter checkpoints rather than the frontier-scale proprietary systems on which deployed products are built, so these magnitudes characterise the instrument on a designed stress test rather than any commercial tool. Verification, disclosure, and accountability cannot be exercised over what has never been characterised; FACETS-PR is offered as one candidate instrument, and its reference implementation is released with this manuscript."
  },
  "sections": [
    {
      "type": "list",
      "title": "Contributions",
      "ordered": true,
      "align": "left",
      "items": [
        "<b>FACETS-PR</b>, a six-axis framework of sixteen metric definitions pairing each pathology with an estimator whose construct-validity claim is stated so that it can be contested.",
        "A <b>computational form of “generative suspicion”</b> as four measures, and a <b>paired-dialect probe</b> for the police-report domain supporting audits of the kind California’s Racial Justice Act contemplates.",
        "A <b>protocol</b> needing no proprietary interface, over a <b>synthetic ground-truth corpus</b> whose difficulty strata are text-level analogues of four of the five degradation scenarios the vendor discloses.",
        "An <b>instantiation on four open-weight models</b>, documented in datasheet and model-card style, that is also an audit of the instrument: four of its fourteen reported quantities prove uninformative as operationalised, and we report that alongside the positive results."
      ]
    },
    {
      "type": "group",
      "title": "The FACETS-PR Framework",
      "blocks": [
        {
          "type": "text",
          "align": "justify",
          "body": "FACETS-PR targets the drafting stage of the three-stage AI-assisted reporting pipeline (recording, transcription, and drafting), in which a large language model turns a body-worn camera (BWC) transcript into a first draft for the officer to review and sign. This stage is the locus of the substantive errors that concern prosecutors and scholars, the stage that SB 524’s disclosure mandate covers, and the only one reproducible without proprietary components. The framework organises sixteen metric definitions into six axes, each targeting pathologies that are documented, doctrinally identified, predicted, or statutory, and states every metric with its construct-validity claim. The axes are not assumed to be statistically independent; their joint structure is examined empirically in the results."
        },
        { "type": "subtitle", "text": "Six Axes" },
        {
          "type": "table",
          "caption": "<b>The six axes of FACETS-PR.</b> Each axis is listed with its disciplinary anchor and the pathologies it targets.",
          "columns": [
            { "header": "Axis", "align": "left" },
            { "header": "Construct", "align": "left" },
            { "header": "Discipline anchor", "align": "left" },
            { "header": "Pathology", "align": "left" }
          ],
          "rows": [
            { "cells": ["F", "Source fidelity", {"v": "Forensic linguistics; faithfulness in natural-language generation", "class": "t-wrap"}, {"v": "Hallucinated content (D); speaker-attribution errors (D); loss of exact language (I); coreference inconsistency (P)", "class": "t-wrap"}] },
            { "cells": ["A", "Asymmetric exculpatory recall", {"v": "Evidentiary doctrine: <i>Brady</i>", "class": "t-wrap"}, {"v": "Risk that AI omits innocence-relevant facts under <i>Brady</i> (I)", "class": "t-wrap"}] },
            { "cells": ["C", "Cognitive disengagement", {"v": "Human-factors automation bias", "class": "t-wrap"}, {"v": "Cognitive offloading; reduced review engagement (I)", "class": "t-wrap"}] },
            { "cells": ["E", "Equity, dialect parity", {"v": "Sociolinguistics and fairness in machine learning", "class": "t-wrap"}, {"v": "Racial Justice Act exposure; dialect-conditioned disparity (I)", "class": "t-wrap"}] },
            { "cells": ["T", "Traceability", {"v": "Legal informatics; SB 524", "class": "t-wrap"}, {"v": "Disclosure and audit-trail requirements (statutory)", "class": "t-wrap"}] },
            { "cells": ["S", "Suspicion inflation", {"v": "Legal natural-language processing; epistemic modality", "class": "t-wrap"}, {"v": "“Generative suspicion” (I); conclusory probable cause (P)", "class": "t-wrap"}] }
          ],
          "legend": "Pathologies are labelled documented (D) in a deployed system, identified (I) doctrinally or by human-factors work but not yet observed in one, predicted (P) from generative behaviour, or statutory."
        },
        { "type": "subtitle", "text": "Sixteen Metric Definitions" },
        {
          "type": "table",